{
  "format": "ekole.kristal-interactions/1.0",
  "kristal_id": "qc-pri-ma-030",
  "cours_annee_proposee": 2,
  "annee_statut": "proposition_non_validee",
  "etat": "proposition_non_validee",
  "activites": [
    {
      "id": "diagramme-classe",
      "type": "diagramme",
      "competence_ciblee": "Lire un relevé et en vérifier le total",
      "usage": "entrainement_non_certifiant"
    }
  ]
}
