{
  "format": "ekole.kristal-interactions/1.0",
  "kristal_id": "qc-pri-ma-009",
  "cours_annee_proposee": 3,
  "annee_statut": "proposition_non_validee",
  "etat": "proposition_non_validee",
  "activites": [
    {
      "id": "partage-14",
      "type": "jetons",
      "competence_ciblee": "Représenter le partage et le groupement pour résoudre des divisions.",
      "usage": "entrainement_non_certifiant"
    }
  ]
}
