{
  "format": "ekole.kristal-interactions/1.0",
  "kristal_id": "qc-pri-ma-003",
  "cours_annee_proposee": 2,
  "annee_statut": "proposition_non_validee",
  "etat": "proposition_non_validee",
  "activites": [
    {
      "id": "centaines-372",
      "type": "position",
      "competence_ciblee": "Décomposer et recomposer selon les valeurs de position",
      "usage": "entrainement_non_certifiant"
    },
    {
      "id": "centaines-508",
      "type": "position",
      "competence_ciblee": "Comprendre le rôle du zéro dans la décomposition",
      "usage": "entrainement_non_certifiant"
    }
  ]
}
