{
  "format": "ekole.kristal-interactions/1.0",
  "kristal_id": "qc-pri-ma-005",
  "cours_annee_proposee": 3,
  "annee_statut": "proposition_non_validee",
  "etat": "proposition_non_validee",
  "activites": [
    {
      "id": "arrondir-147",
      "type": "droite",
      "competence_ciblee": "Produire une estimation défendable et arrondir selon un rang annoncé.",
      "usage": "entrainement_non_certifiant"
    },
    {
      "id": "arrondir-263",
      "type": "droite",
      "competence_ciblee": "Produire une estimation défendable et arrondir selon un rang annoncé.",
      "usage": "entrainement_non_certifiant"
    }
  ]
}
